{
  "proposalId": "MIP-12",
  "success": true,
  "decodedCalls": [
    {
      "target": "0xDc64a140Aa3E981100a9becA4E685f962f0cF6C9",
      "contractName": "Treasury",
      "selector": "0xbeabacc8",
      "signature": "transfer(address,address,uint256)",
      "args": [
        "0xe7f1725E7734CE288F8367e1Bb143E90bb3F0512",
        "0xa0Ee7A142d267C1f36714E4a8F75612F20a79720",
        "400000000000"
      ]
    },
    {
      "target": "0xe7f1725E7734CE288F8367e1Bb143E90bb3F0512",
      "contractName": "MockUSDC",
      "selector": "0xa9059cbb",
      "signature": "transfer(address,uint256)",
      "args": [
        "0xa0Ee7A142d267C1f36714E4a8F75612F20a79720",
        "400000000000"
      ]
    }
  ],
  "tokenTransfers": [
    {
      "token": "0xe7f1725E7734CE288F8367e1Bb143E90bb3F0512",
      "from": "0xDc64a140Aa3E981100a9becA4E685f962f0cF6C9",
      "to": "0xa0Ee7A142d267C1f36714E4a8F75612F20a79720",
      "amount": "400000000000"
    }
  ],
  "approvals": [],
  "ownershipChanges": [],
  "implementationChanges": [],
  "storageDiffs": [],
  "events": [
    {
      "contract": "0xe7f1725E7734CE288F8367e1Bb143E90bb3F0512",
      "name": "Transfer",
      "args": {
        "from": "0xDc64a140Aa3E981100a9becA4E685f962f0cF6C9",
        "to": "0xa0Ee7A142d267C1f36714E4a8F75612F20a79720",
        "value": "400000000000"
      }
    },
    {
      "contract": "0xDc64a140Aa3E981100a9becA4E685f962f0cF6C9",
      "name": "Sent",
      "args": {
        "token": "0xe7f1725E7734CE288F8367e1Bb143E90bb3F0512",
        "to": "0xa0Ee7A142d267C1f36714E4a8F75612F20a79720",
        "amount": "400000000000"
      }
    }
  ],
  "bytecodeHash": "0x0000000000000000000000000000000000000000000000000000000000000000",
  "simHash": "0x38033e1e653a27f916eb460cfaf6013be08e0427b9a8d3a26a329da8724a43b0"
}
