{
  "proposalId": "MIP-21",
  "success": true,
  "decodedCalls": [
    {
      "target": "0x0165878A594ca255338adfa4d48449f69242Eb8F",
      "contractName": "Vault (ERC1967Proxy)",
      "selector": "0x4f1ef286",
      "signature": "upgradeToAndCall(address,bytes)",
      "args": [
        "0x17F24D3b8Bc1150553b54Da30B4d993AcB889212",
        "0xbe6b99e3000000000000000000000000df3e18d64bc6a983f673ab319ccae4f1a57c7097"
      ]
    },
    {
      "target": "0x0165878A594ca255338adfa4d48449f69242Eb8F",
      "contractName": "VaultV2 (delegatecall)",
      "selector": "0xbe6b99e3",
      "signature": "reinitializeV2(address)",
      "args": [
        "0xdF3e18d64BC6A983f673Ab319CCaE4f1a57C7097"
      ]
    },
    {
      "target": "0xDc64a140Aa3E981100a9becA4E685f962f0cF6C9",
      "contractName": "Treasury",
      "selector": "0xe1f21c67",
      "signature": "approve(address,address,uint256)",
      "args": [
        "0xe7f1725E7734CE288F8367e1Bb143E90bb3F0512",
        "0xdF3e18d64BC6A983f673Ab319CCaE4f1a57C7097",
        "115792089237316195423570985008687907853269984665640564039457584007913129639935"
      ]
    },
    {
      "target": "0xe7f1725E7734CE288F8367e1Bb143E90bb3F0512",
      "contractName": "MockUSDC",
      "selector": "0x095ea7b3",
      "signature": "approve(address,uint256)",
      "args": [
        "0xdF3e18d64BC6A983f673Ab319CCaE4f1a57C7097",
        "115792089237316195423570985008687907853269984665640564039457584007913129639935"
      ]
    }
  ],
  "tokenTransfers": [],
  "approvals": [
    {
      "token": "0xe7f1725E7734CE288F8367e1Bb143E90bb3F0512",
      "owner": "0xDc64a140Aa3E981100a9becA4E685f962f0cF6C9",
      "spender": "0xdF3e18d64BC6A983f673Ab319CCaE4f1a57C7097",
      "amount": "115792089237316195423570985008687907853269984665640564039457584007913129639935"
    }
  ],
  "ownershipChanges": [
    {
      "contract": "0x0165878A594ca255338adfa4d48449f69242Eb8F",
      "role": "owner",
      "before": "0x9fE46736679d2D9a65F0992F2272dE9f3c7fa6e0",
      "after": "0xdF3e18d64BC6A983f673Ab319CCaE4f1a57C7097"
    }
  ],
  "implementationChanges": [
    {
      "proxy": "0x0165878A594ca255338adfa4d48449f69242Eb8F",
      "before": "0x5FC8d32690cc91D4c39d9d3abcBD16989F875707",
      "after": "0x17F24D3b8Bc1150553b54Da30B4d993AcB889212",
      "addedSelectors": [
        {
          "selector": "0x0db4818a",
          "signature": "migrateReserves(address)"
        },
        {
          "selector": "0xbe6b99e3",
          "signature": "reinitializeV2(address)"
        }
      ],
      "removedSelectors": []
    }
  ],
  "storageDiffs": [
    {
      "contract": "0x0165878A594ca255338adfa4d48449f69242Eb8F",
      "slot": "0x360894a13ba1a3210667c828492db98dca3e2076cc3735a920a3ca505d382bbc",
      "before": "0x0000000000000000000000005fc8d32690cc91d4c39d9d3abcbd16989f875707",
      "after": "0x00000000000000000000000017f24d3b8bc1150553b54da30b4d993acb889212"
    },
    {
      "contract": "0x0165878A594ca255338adfa4d48449f69242Eb8F",
      "slot": "0x9016d09d72d40fdae2fd8ceac6b6234c7706214fd39c1cd1e609a0528c199300",
      "before": "0x0000000000000000000000009fe46736679d2d9a65f0992f2272de9f3c7fa6e0",
      "after": "0x000000000000000000000000df3e18d64bc6a983f673ab319ccae4f1a57c7097"
    }
  ],
  "events": [
    {
      "contract": "0x0165878A594ca255338adfa4d48449f69242Eb8F",
      "name": "Upgraded",
      "args": {
        "implementation": "0x17F24D3b8Bc1150553b54Da30B4d993AcB889212"
      }
    },
    {
      "contract": "0x0165878A594ca255338adfa4d48449f69242Eb8F",
      "name": "OwnershipTransferred",
      "args": {
        "previousOwner": "0x9fE46736679d2D9a65F0992F2272dE9f3c7fa6e0",
        "newOwner": "0xdF3e18d64BC6A983f673Ab319CCaE4f1a57C7097"
      }
    },
    {
      "contract": "0x0165878A594ca255338adfa4d48449f69242Eb8F",
      "name": "Initialized",
      "args": {
        "version": "2"
      }
    },
    {
      "contract": "0xe7f1725E7734CE288F8367e1Bb143E90bb3F0512",
      "name": "Approval",
      "args": {
        "owner": "0xDc64a140Aa3E981100a9becA4E685f962f0cF6C9",
        "spender": "0xdF3e18d64BC6A983f673Ab319CCaE4f1a57C7097",
        "value": "115792089237316195423570985008687907853269984665640564039457584007913129639935"
      }
    }
  ],
  "bytecodeHash": "0x92ff4c77b74114ec60e6d388b53712b4e125417d7277a5b98ea6036c4a4d05d9",
  "simHash": "0x077c2655f0bbb291f1fbc5af2e71f06e2da54ed28d65f044825bcef8190de7be"
}
